{
  "id": "ses-roundtrip-issue508-dac2020-dac2020-bm10-frv1-9-0-dac2020-bm10-unrouted",
  "kind": "ses-roundtrip",
  "origin": "both",
  "tier": "fast",
  "board": "Issue508-DAC2020-DAC2020_bm10-FRv1.9.0-DAC2020_bm10.unrouted.dsn",
  "expect": {
    "treeEquals": {
      "equalsFile": "ses/Issue508-DAC2020-DAC2020_bm10-FRv1.9.0-DAC2020_bm10.unrouted.dsn.unrouted.sexp.json"
    }
  },
  "note": "readDsn then writeSes on the unrouted board; the normalised session tree must deep-equal ses/Issue508-DAC2020-DAC2020_bm10-FRv1.9.0-DAC2020_bm10.unrouted.dsn.unrouted.sexp.json (31332 bytes, fast tier)."
}
