{
  "id": "parse-summary-issue757-minimal-soe",
  "kind": "parse",
  "origin": "both",
  "tier": "fast",
  "board": "Issue757-minimal-soe.dsn",
  "expect": {
    "status": {
      "exact": "ok"
    },
    "summaryEquals": {
      "equalsFile": "parse/Issue757-minimal-soe.dsn.json"
    }
  },
  "note": "readDsn must succeed and the normalised summary must deep-equal parse/Issue757-minimal-soe.dsn.json (917 bytes, fast tier). Both references agree on every field."
}
