{
  "id": "ses-roundtrip-issue070-autorouter-fq101-pcb-2022-05-13",
  "kind": "ses-roundtrip",
  "origin": "both",
  "tier": "fast",
  "board": "Issue070-Autorouter_FQ101_PCB_2022-05-13.dsn",
  "expect": {
    "treeEquals": {
      "equalsFile": "ses/Issue070-Autorouter_FQ101_PCB_2022-05-13.dsn.unrouted.sexp.json"
    }
  },
  "note": "readDsn then writeSes on the unrouted board; the normalised session tree must deep-equal ses/Issue070-Autorouter_FQ101_PCB_2022-05-13.dsn.unrouted.sexp.json (121895 bytes, fast tier)."
}
