{
  "id": "settings-fast-rules-issue191-processor-z80-processor",
  "kind": "settings",
  "origin": "new",
  "tier": "fast",
  "board": "Issue191-processor.Z80-processor.Z80.dsn",
  "rules": "Issue191-processor.Z80-processor.rules",
  "settings": {
    "router": false,
    "useFileSettings": true
  },
  "expect": {
    "viaCost": {
      "exact": 50
    },
    "planeViaCost": {
      "exact": 5
    },
    "startRipupCost": {
      "exact": 100
    },
    "viasAllowed": {
      "exact": true
    },
    "optimizerEnabled": {
      "exact": true
    },
    "fanoutEnabled": {
      "exact": false
    },
    "routerEnabled": {
      "exact": false
    },
    "layers/F.Cu/active": {
      "exact": true
    },
    "layers/F.Cu/preferDir": {
      "exact": "h"
    },
    "layers/F.Cu/alongCost": {
      "exact": 1
    },
    "layers/F.Cu/againstCost": {
      "exact": 2.5
    },
    "layers/B.Cu/active": {
      "exact": true
    },
    "layers/B.Cu/preferDir": {
      "exact": "v"
    },
    "layers/B.Cu/alongCost": {
      "exact": 1
    },
    "layers/B.Cu/againstCost": {
      "exact": 1.7
    }
  },
  "note": "useFileSettings: true with a rules file: the rules file's settings block is applied the same way as a DSN settings block (and replaces the DSN's block when both exist). The rules file carries the same settings block as the board itself; F.Cu horizontal 1.0/2.5, B.Cu vertical 1.0/1.7."
}
