{
  "id": "ses-apply-issue508-dac2020-dac2020-bm11-frv2-1-0-dac2020-bm11",
  "kind": "ses-apply",
  "origin": "new",
  "tier": "fast",
  "board": "Issue508-DAC2020-DAC2020_bm11-DAC2020_bm11.unrouted.dsn",
  "ses": "Issue508-DAC2020-DAC2020_bm11-FRv2.1.0-DAC2020_bm11.ses",
  "reference": "Issue508-DAC2020-DAC2020_bm11-FRv2.1.0-DAC2020_bm11.ses.applied-ses.json",
  "expect": {
    "incomplete": {
      "exact": 25
    },
    "barrels": {
      "exact": 19
    },
    "violations": {
      "exact": 0
    },
    "tracks": {
      "exact": 247
    }
  },
  "note": "A session for benchmark board 11 produced by a reference build (current)."
}
