{
  "id": "parse-summary-issue508-dac2020-dac2020-bm09-dac2020-bm09-unrouted",
  "kind": "parse",
  "origin": "both",
  "tier": "fast",
  "board": "Issue508-DAC2020-DAC2020_bm09-DAC2020_bm09.unrouted.dsn",
  "expect": {
    "status": {
      "exact": "ok"
    },
    "summaryEquals": {
      "equalsFile": "parse/Issue508-DAC2020-DAC2020_bm09-DAC2020_bm09.unrouted.dsn.json"
    }
  },
  "note": "readDsn must succeed and the normalised summary must deep-equal parse/Issue508-DAC2020-DAC2020_bm09-DAC2020_bm09.unrouted.dsn.json (24952 bytes, fast tier). The summary's notes list where the references disagreed and which ruling applies."
}
