{
  "id": "parse-summary-issue110-pajalnaja-stancija",
  "kind": "parse",
  "origin": "both",
  "tier": "fast",
  "board": "Issue110-Pajalnaja_stancija.dsn",
  "expect": {
    "status": {
      "exact": "ok"
    },
    "summaryEquals": {
      "equalsFile": "parse/Issue110-Pajalnaja_stancija.dsn.json"
    }
  },
  "note": "readDsn must succeed and the normalised summary must deep-equal parse/Issue110-Pajalnaja_stancija.dsn.json (27461 bytes, fast tier). The summary's notes list where the references disagreed and which ruling applies."
}
